,titles,category
293,담임 얼굴 노출 사진 합성한 초등생 되레  아동학대  신고,Social
294,나주서 오피스텔 보증금   억 원 가로챈   대 구속,Social
295, 위안부는 매춘의 일종  류석춘 교수  년여 만에 무죄,Social
296,초대형 겨울축제  서울윈타     만명 발길  글로벌 축제로 ,Social
297, 수사 무마  미끼 수억 가로챈 검사 출신 변호사  징역  년,Social
298, 액운 털어내려고  울산 대왕암공원 낙서   대 여성 검거,Social
299,해병대  영하   도 추위 속 설한지 훈련  적의 어떤 도발에도 압도적 대비를 ,Social
300,광주시  전남도에 광역철도 노선변경  최후통첩  갈등 심화,Social
301, 위안부  자발적 매춘  발언 류석춘  무죄  정대협 부분 일부 유죄 상보 ,Social
302,바위틈 넣어둔 속옷에 덜미 울산 대왕암공원 낙서범 잡혔다,Social
303,서울형 키즈카페 올해    개로 늘린다 주말 운영시간도 연장,Social
304,   만명 찾은  서울윈타  서울 대표 겨울축제 브랜드로 육성,Social
305, 서울형 키즈카페     개로 늘린다 주말 오후  시까지 운영,Social
306, 위안부 명예훼손 논란  류석춘   심서 벌금형 일부 유죄,Social
307,안동상의 회장추대위   현 회장 사퇴  이동찬씨 추대키로 ,Social
308,제주 하늘길 뚫렸지만  한라산은  일째 통제   눈     이상 쌓여,Social
309,해외연수 시의원들에    달러씩  돈봉투  강수현 양주시장 송치,Social
310, 시화 매립지  꽃 향기 정원으로 탈바꿈     년까지  경기정원 ,Social
311,울산 대왕암공원 바위 낙서범 잡아  액운 막으려 그랬다 ,Social
312, 내가 기소한 사건  구형 줄여줄게  전관 변호사 징역  년,Social
313, 한국건설 수분양자 피해 최소화  조오섭  국토부  차관에 대책 마련 요구,Social
314, 민폐 주차   에 주차금지 입간판 올려 경고한 주민  벌금형 무죄,Social
315,밀양 부북면   번 국도서 추돌사고 오토바이 운전자 숨져,Social
316,지하철 탑승 시위 중 직원 깨문 전장연 활동가 구속영장,Social
317,소이증  귀재건 중 혈관손상 위험  이 경우  수술 주의를,Social
318,롤스로이스   심 징역   년 피해자 측  구형 더 높았다면  종합 ,Social
319, 스브스픽  판사도  마땅히 중형   압구정 롤스로이스  징역   년,Social
320,폭설에 빙판길 된 제주  눈길사고   건   명 병원이송,Social
321,야근한 직원에게  새벽 별 보러 가자  양평 데려간 대기업 간부,Social
322, 처벌 낮춰준다  수억 원 수수 혐의 검찰 전관 변호사 실형,Social
323,회삿돈  억원 빼돌려 도박으로 탕진한   대 징역  년,Social
324, 롤스로이스 사망 사건  운전자 징역   년 도주 약물 모두 인정돼,Social
325,학교 떠나는 유 초등 교사들 서울 공립 명퇴   년 간 최대,Social
326,주차된 차  쾅쾅  철원서 음주사고 후 미조치 도주   대 붙잡혀,Social
327,전희경  의정부갑 출마선언  의정부는 삶의 뿌리이자 원천 ,Social
328, 액운 털어내려고    울산 대왕암공원  바다남  낙서범 잡았다,Social
329, 피해자 보고 웃어  압구정 롤스로이스 운전자 징역   년,Social
330,밀양서 사고 난 승용차 추돌  오토바이 운전자 숨져,Social
331, 피해자 보며 웃었다  판사도 분노 롤스로이스  징역   년,Social
332,망치 톱 들고 지구대 찾아온   대  무술   단 경찰에게 제압당했다,Social
333, 위안부는 매춘의 일종  발언한 류석춘 전 연세대 교수 무죄,Social
334,망치 톱 들고 지구대 찾아온   대  무술   단 경찰에게 제압당했다,Social
335, 우리 피 보자  끝을 보자  연락금지 명령에도 전처에  문자    차례  보낸   대,Social
336, 위안부는 자발적 매춘  류석춘 무죄 학문의 자유 인정한 법원,Social
337,류석춘  위안부 발언  무죄 정의연 명예훼손은 벌금형,Social
338,비조합원 앞 못볼 정도 다쳤는데   화물연대  얼굴 안 때려   영상 ,Social
339, 이 음료  한달에 한번만 마셔도 잠 못잔다  수면 질도  뚝  떨어져,Social
340,사흘째  대설특보  광주 전남 빙판길 사고 잇따라,Social
341, 손톱 망가지니 오렌지 좀 까줘  식당 알바에 황당 요구한 손님,Social
342,인천시의회       폄훼 논란  허식 의장 불신임안 통과,Social
343,새 외국인 카지노   년 만에 문 연다,Social
344,  대   숨지게 한  압구정 롤스로이스     심서 징역   년,Social
345, 경찰 치부 드러낸 보도 압수수색 덮으려는 건가  디스패치 반발,Social
346, 압구정 롤스로이스남  징역   년  무고한 사람 희생 ,Social
347, 자녀 앞에서 흉기 휘둘렀다    년 같이 산 아내 살해한 남편,Social
348,개업  주년 음료 서비스 줬더니  우리 애 당뇨 걸린다  제로로 달라  고함,Social
349,학교 운동부 예산     만원 횡령   체육교사  집행유예 ,Social
350,여당 탈당 이언주  돌고 돌아 다시 민주당으로,Social
351,롤스로이스   징역   년 피해자 측  검찰 구형 더 높았다면  종합 ,Social
352,밀양서 사고 난 승용차 추돌  오토바이 운전자 숨져,Social
353,결혼할 여친    차례나  엄벌해달라  딸 얼굴 공개한 유족,Social
354,깍듯이   도 인사한    어깨 툭 치며 악수한  ,Social
355,검찰   장학회 공금  억 횡령  김만복 전 국정원장 징역형 집유에 항소,Social
356,건설업 위기 확산 광주 전남서 법정관리 신청 잇따라,Social
357,밀양서 차량 글램핑장 화재 잇따라  명 숨져,Social
358, 이정도면 같이 쉴만한데   육휴  부모에 최대     만원 혜택 주는 제주,Social
359,   모티브  총기부품 불법 수출 혐의로 전직 직원 고소,Social
360, 피해자 보며 웃었다  롤스로이스    심서 징역   년 선고,Social
361, 수사 무마해줄게  수억 뜯은 검사 출신 변호사   년 실형,Social
362, 집에  초대남  커플 불렀는데 도둑질   억 시계 명품 훔쳐갔다 ,Social
363, 액운 털어내려   울산 대왕암  바다남  낙서한   대 여성 검거,Social
364,     폄훼 논란 허식 인천시의장 불신임안 가결 의장직 상실,Social
365,국내 연구진  극성 반도체 입자인  트라이온 의 생성 원리 찾아,Social
366,  대 여성 치어 숨지게 한  압구정 롤스로이스  운전자 징역   년 선고,Social
367,불법 유턴하다 잡힌   대 알고 보니 사기죄 수배범 법원 실형 선고,Social
368,국가보안시설 또 뚫렸다  한울원전 노트북 무단 반입 파장,Social
369, 구형량 줄여줄게  피의자 속여 수억 챙긴 전직 검사 실형,Social
370,   분 만에 간 한동훈  윤석열 왜 왔나  서천시장 상인들 분노,Social
371,      데이터 폭증 해결할 광원 소자  최초 개발 ,Social
372,    인사청탁  뇌물수수 혐의 현직 치안감 구속영장,Social
373,   분 만에 간 한동훈  윤석열 왜 왔나  서천시장 상인들 분노,Social
374,      데이터 폭증 해결할 광원 소자  최초 개발 ,Social
375,강남구에선 아이 한 명만 낳아도    만원 서울 자치구  출산양육지원금  확대 경쟁,Social
376, 단독 횡령 배임 고발 전남 목포시 출연기관  목포수산물유통센터  경찰 수사 착수,Social
377,류석춘  위안부 매춘발언  무죄 정대협 명예훼손은 유죄로 벌금,Social
378, 오송 참사  충북도 공무원  명  구속 갈림길 영장심사,Social
379,울산 대왕암공원  바다 남  낙서범 붙잡혀  가족 액운 털어내려고 ,Social
380, 압구정 롤스로이스   징역   년 검찰 구형대로 선고,Social
381, 액운 막겠다 며 대왕암공원 기암괴석에 낙서한   대,Social
382, 제가 모시겠습니다   부산 경찰  상사 식사 챙기는  모시는 날  논란,Social
383,고양시  자유로 지하화 등 광역교통 도로망 개선  교통체증 해소,Social
384,고양시  출퇴근 도로망 개선 총력  교통체증 해소 ,Social
385,      폄훼  논란 인천시의장 불신임안 가결 의장직 상실,Social
386,제주공항 항공기 운항 정상화 국내선 등   편만 결항,Social
387, 롤스로이스    심서 징역   년  증거인멸 급급  피해자 보고 웃어 ,Social
388,추락 사망 전 비슷한 사고    소 잃고도 외양간 안 고친 삼성중공업,Social
389, 시의원 돈봉투 전달  강수현 양주시장 송치,Social
390, 손가락 아픈데 오렌지 껍질 까줘   알바생에게 황당 요구,Social
391,살인죄 출소  년  개월만에 성폭행   대  항소심서 형량 늘어,Social
392, 구형량 줄여줄게  피의자 속여 수억 챙긴 전직 검사 실형,Social
393, 영상   아악   나체 상태로 집안 뛰어다닌 남성 잡고 보니  마약 ,Social
394,자월도 해안가 승용차 안에서 남녀  명 숨진 채 발견,Social
395,사람 얼굴  확  문 들개    포획 나섰지만  아직   지금이뉴스 ,Social
396,강릉서  음주 운전    대 러시아인 전봇대 들이받아  차량 전소,Social
397, 위안부는 매춘의 일종  류석춘 전 연세대 교수  심  무죄 ,Social
398,   서 만난 여성 신체 몰래 촬영한   대,Social
399, 압수한 돈 돌려달라  소송 낸 보이스피싱 환전책  패소 ,Social
400, 액운 털어내려고  울산 대왕암공원 바위 낙서범 검거,Social
401,김포 고등학교서 한밤중 화재   시간반만에 완진  인명피해 없어,Social
402,  보  류석춘  위안부 매춘발언  무죄 정대협 명예훼손은 일부 유죄,Social
403, 뇌사자 간 기다리던 중증환자  생체 간 이식하니 생존율  배  ,Social
404, 구형량 줄여주겠다 며 금품 수수 전관 변호사  심 실형,Social
405,몸에 좋은 황기  이렇게 볶으면 인지능력 개선  쑥 ,Social
406, 남북활주로 까지 열렸다   제주공항 체류객  만 명 빠져나가나,Social
407,초등생들  비키니  합성  뿌렸는데 아동학대 신고당한 교사,Social
408, 지하철 탑승 시위  전장연 활동가 구속영장,Social
409,류석춘  위안부는 매춘   심 무죄   정대협 관련 발언엔 벌금    만원,Social
410, 얼굴 물려   바늘 꿰맸다  부산 한복판  야생 들개  비상,Social
411, 수도권 대학 진학생 집 주겠다    울릉군수  교육정책  파격 제안,Social
412, 마약 롤스로이스 뺑소니  가해자  심 징역   년,Social
413, 내가 기소한 사건  구형 줄여줄게  돈 챙긴 전직 검사 실형,Social
414,복지부  인구 줄지만 고령화로 의료 수요 팽창 ,Social
415, 통로주차   에 주차금지 간판 올렸다가 벌금형  심서 무죄로,Social
416,인천 자월도에 주차된 차량서 남녀  명 숨진 채 발견,Social
417, 남자의 로망이죠  조규성  장발 유지하는 이유,Social
418, 기부왕 이종환 창업주  김해 삼영산업  직원    명 해고 통보,Social
419,인천 자월도 주차 차량서 남녀  명 숨진 채 발견 경찰 수사,Social
420,고양시   자유로 지하고속도로  등 광역도로 교통개선 추진,Social
421,울산 대왕암 낙서는 주술 행위   대 여성 검거  남자들 좋은 기운   ,Social
422,롤스로이스로 인도 돌진해 사망사고 낸   대  징역   년 선고,Social
423, 액운 막으려  대왕암에  바다남  낙서,Social
424,편두통 예방에 좋은 약은,Social
425,지자체  급 승진 교육  베껴 쓰기  없어진다,Social
426, 전기장판  절대  이것 과 같이 쓰지 마세요 ,Social
427, 뉴스라이브  설 대목 앞둔 서천특화시장 화재   오늘 감식 착수,Social
428, 속보  법원  압구정 롤스로이스 사고  가해자 징역   년 선고,Social
429,플라스틱 공장서 혼자 일하던   대 남성 금형 기계에 참변,Social
430,      폄훼  인천시의장 불신임안 가결  의장직 상실 의원신분 유지 ,Social
431, 콘서트 티켓 싸게 팔아요      만원 사기친   대 실형,Social
432, 위안부는 매춘  발언 류석춘 전 교수 무죄 정대협 명예훼손은 일부 유죄,Social
433, 부하직원 돈으로 상급자 밥 사먹여  부산경찰 악습에 감찰 조사,Social
434,지구대 찾아가 망치 톱으로 경찰 위협    대 송치,Social
435, 민폐 주차  차량에 주차금지 입간판 올려 응징  무죄 ,Social
436,     억대 장학회 돈 횡령  김만복   국정원장  심 판결에 항소,Social
437, 맨날 술 먹고 염 하지  청년센터에 욕설 폄훼 쏟아낸 시의원,Social
438,법원  도주치사  압구정 롤스로이스남  징역   년 선고,Social
439,마약운전 교통사고에 도주까지 롤스로이스 뺑소니 징역   년 선고,Social
440,     은 내란  배포 논란 인천시의회 의장 불신임안 가결,Social
441,광주 북구을 여론조사서 이형석 전진숙 초박빙 접전,Social
442, 광주    김낙곤 사장 기소를 촉구합니다 ,Social
443,  대 여성 사망케 한  압구정 롤스로이스남  징역   년형 선고,Social
444, 단독   쌍방울 대북송금 의혹 수사  김영남 부장검사 사의 표명,Social
445,   인 미만 사업장  안전체계 만들겠다  정부  국회에 중처법 유예 호소,Social
446,       에   앞유리가 와장창    지붕에 쌓인 눈   얼음 흉기 로 돌변,Social
447,회삿돈  억 횡령해 도박 탕진한 인사팀 직원에 징역  년,Social
448, 내가 기소한 사건  구형 줄여줄게  돈 챙긴 전직 검사 실형,Social
449, 속보  명예훼손 아냐   위안부는 매춘  발언 류석춘 전 연세대 교수 무죄,Social
450,롤스로이스   심 징역   년  도주치사 혐의      죄책 중해 ,Social
451,한라산에 나흘간       눈 쌓여 내일까지     더 내릴 듯,Social
452,인천 전역 한파주의보 해제 오전   시          도,Social
453,경기도가  문재인 정부  통계조작 의혹 수사를 홍보 ,Social
454,이 강추위에 고공농성    그는 이런 사람입니다,Social
455, 집안 남자들 좋은 기운 받게 하려고   울산 대왕암공원 낙서범의 해명,Social
456, 아아악   알몸으로 뛰어다닌 남성  제압하고 보니   ,Social
457, 액운 막으려  울산 대왕암공원 낙서범 검거,Social
458, 속보   위안부는 자발적 매춘  류석춘   심 벌금    만원 선고,Social
459,이경규 장도연 등에 출연료 안 준 기획사 대표  횡령 혐의 집유,Social
460,    원만      년째 지속된  온라인 구걸 에 누리꾼 눈살,Social
461, 콘서트 티켓 싸게 팔아요      만원  먹튀 한   대  징역  년,Social
462,      왜곡 신문 배포  허식 인천시의장직 상실 불신임안 가결 종합 ,Social
463,부산 북항재개발지역 관통  이순신대로    일 개통,Social
464,밀양서 차량 글램핑장 화재 잇따라  명 숨져,Social
465, 고발 사주  제보자 조성은  입당원서 조작 혐의로 재판행,Social
466, 속보   위안부는 자발적 매춘  류석춘 교수  심서 무죄,Social
467, 만    여명 발 묶인 제주공항    일 항공편 재개,Social
468, 최대       폭설  광주 전남 빙판길 교통사고도  속출  종합 ,Social
469,롤스로이스    심   년형  반성않고 증거인멸 급급  상보 ,Social
470, 속보   압구정 마약 롤스로이스     심서 징역   년,Social
471,지하도 침수 위험 실시간 안내 민관 손잡고 내비게이션 고도화,Social
472, 압구정 롤스로이스 사망 사고  가해자  심 징역   년,Social
473,겨울잠 자고    만 원 받는다 시몬스 이색 알바   만 명 몰려,Social
474, 롤스로이스 인도 돌진  가해자 징역   년 선고,Social
475, 역무원 시절부터   년 준비   지하철   분 재승차 제안  임국현 서울시 팀장 스 우 파 ,Social
476, 압구정 롤스로이스  인도 돌진   대   심 징역   년,Social
477,역사적 상징물에    자가    서울 울산에 이어 제주도 낙서 테러,Social
478,비행기 떴다 기상악화 풀린 제주공항 항공기 운항 정상화,Social
479, 그 때 참 힘들었지    대  남성보다 자살 충동  배 더 컸던 시기,Social
480,루이비통  샤넬  짝퉁 명품 에 발암 물질  범벅 ,Social
481, 압구정 롤스로이스 사고  운전자   심서 징역   년,Social
482,    중 엉덩이 움켜쥐었다  트레이너 성추행 신고했지만  무혐의 ,Social
483,  기업까지 뛰어든 가정용 심전계 시장 최후 승자는 ,Social
484,담임에 노출 여성 합성한 학생들 교권 피해 신고에  아동학대  보복 ,Social
485,제주  성급 리조트 더 시에나   박에  박 더  프로모션,Social
486, 미분양 무덤  대구서 주택사업승인 반납 사례 발생,Social
487, 속보   압구정 마약 롤스로이스 운전자   심 징역   년,Social
488,셀트리온    우시   와     신약 개발 공동 개발,Social
489, 도주치사 혐의  롤스로이스   심 징역   년    죄책 중해   보 ,Social
