,titles,category
284, 호주는 아침  시부터  대형마트 영업시간 조정  가능할까  언박싱 ,Economic
285,열에 아홉은 뉴욕장 해외 주식    편식 비중  역대 최대  왜   투자    ,Economic
286,시몬스 침대  시급    만 원  겨울잠 알바 에  만명 몰렸다,Economic
287,농심신라면  작년매출  조 천억원  사상최대  해외가 절반 넘어,Economic
288, 공모주 단골 청약 매매 보고 누락  금감원 거래소 직원 무더기 제재,Economic
289,토스뱅크  외화통장 불티   환전수수료 무료 앞세워  일 만에   만좌 돌파 ,Economic
290,   증시 최대     폭락 가능성    조심해야 할  가지 리스크,Economic
291, 명품  귀걸이인 줄 알았더니 발암 물질    배 검출,Economic
292,대한항공 아시아나 합병 윤곽  산은  일석이조  기대감  투자    ,Economic
293,경기  국평  분양가  년새  억 뛰었다 광주는     상승 집슐랭 ,Economic
