,titles,category
0,택시 승객  반대 방향  말에 유턴 고속도로  공포의 역주행 ,Social
1,  대 살인전과자    대 이웃 성폭행 형량 늘어 징역   년,Social
2,김남국  햄버거집에서 소개팅  반씩 나눠먹었다  호소,Social
3,롤스로이스  에게 마약 처방하고 환자 성폭행   대 의사 구속기소,Social
4, 나 잡아봐라  피 흘리며 뛰어다니던 알몸   경찰이 체포하니,Social
5, 내 엉덩이 꽉 움켜쥐고 주무른 헬스트레이너  왜 무혐의입니까 ,Social
6,  월 출생아 또  역대 최저    개월째 줄어든 대한민국,Social
7, 볼 터지겠네   연차 낼까  강추위에 대구시민들 발동동,Social
8,광주시 올 하반기 승진 풍년에 활력,Social
9,벙커 유   억 원어치 훔쳐 내다판 일당 검거,Social
10,국정원   공공분야 해킹    는   소행  총선 개입 공작 우려 ,Social
11, 출소 일주일 만에 또  벽돌 든   대 편의점 강도 항소심도 징역  년,Social
12, 구형 줄여주겠다 며 돈 받은 검사 출신 변호사 실형,Social
13,        녹말 이쑤시개 튀김  영상 유행에 식약처 긴급 경고,Social
14,원주서 제조된  강남 마약음료  제조책 구속 기소 중국서 송환,Social
15, 현장컷   즉각  강력하게  끝까지 응징  해병대 평창서 영하   도 혹한 속 훈련,Social
16,나주 공동혁신도시서 무자본 갭투자로   세대 전세사기   대 구속,Social
17, 롤스로이스  마약처방  의사   환자   명 성폭행 혐의도 구속기소,Social
18,보이스피싱 전달책  국가 상대 소송  압수한 돈 돌려달라  결국  패소 ,Social
19, 위안부는 자발적 매춘  류석춘  교수  피해자 명예훼손 무죄,Social
20,노동부 익산지청  실업급여 부정수급자   명 적발,Social
21,경영 악화에도 기부 결국  전직원 해고통보 한 이 회사,Social
22,정박해 있는 배에서 기름   억원어치 빼돌린 일당 적발,Social
23,안산 플라스틱 제품공장서   대 노동자 끼임 사고로 숨져,Social
24,흉기 목에 대고 협박한   대     단 유단자  경찰이 맨손 제압한 순간,Social
25, 구형 줄여줄게  돈 챙긴 전직 검사 실형,Social
26,검찰  중국서 송환된  강남 마약 음료  제조책 구속 기소,Social
27,경찰  경희대 입학처 압수수색  음대 교수들 불법 과외 입시 비리 의혹,Social
28, 강원     문화를 만나다  문화도시 강릉의 매력 전 세계에 알릴 것 ,Social
29, 학원가 마약 음료  주범인   대 남성 구속 기소,Social
30,부산    억 전세 사기   대 징역   년 판사는  탐욕 제어 못 한 시스템 탓  피해자는 잘못 없다  위로,Social
31,     폭설  광주 전남 대설특보 사흘 만에 모두 해제,Social
32,      폄훼 불신임안 상정 거부  허식 인천시의장  결국 권한 박탈,Social
33,올해 설 차례상 비용은 전통시장    만원   대형마트   만원 ,Social
34,인천 자월도 주차된 차량서 남녀  명 숨진 채 발견,Social
35, 압구정 롤스로이스남 에 마약류 불법 처방한 의사 구속기소,Social
36,놀라운    튜터  제자들  이건 카타르시스를 못 줘요 ,Social
37,출생아 수 또  역대 최저치     줄어  만     명,Social
38, 교수 불법과외 의혹  경희대 음대 압수수색,Social
39,  대 공익근무요원 근무지서 극단 선택 경찰 수사,Social
40,노동부 익산지청  실업급여 부정수급자   명 적발,Social
41,음대 입시비리 전방위 확대 불법과외 의혹 경희대  압색 ,Social
42,수상한 남편의 한밤 외출  카톡 보니 아파트 동대표와 여행까지,Social
43, 풍경  북극 한파에 충북 단양강  꽁꽁 ,Social
44,김영록 전남지사  민주당으로 단합해야 분열 바람직하지 않아 ,Social
45, 압구정 롤스로이스 사고  가해자  심 징역   년    의사 만류에도 운전 ,Social
46,한 교육학자의 일침  교육부인가  에듀테크 기업부인가  ,Social
47,아시아나항공  밀린 기내식 대금    억 지급 확정,Social
48, 원심력이 뭔지 알려줘   초등생 던진 강사  항소심도 집행유예,Social
49,우리 국회 언제 바꿀래  청년 여성      총선 챌린지,Social
50,음주 무면허  차례 처벌받은 공무원  또 음주운전 적발,Social
51,국민의힘 강수현 양주시장  돈봉투 살포 혐의로 불구속 송치,Social
52,    롤스로이스  마약 처방  의사 구속기소,Social
53,육지보다 비싼 배송비   인천시  섬 주민에   최대   만원 지원,Social
54,부산 한복판에 들개 출몰  시민 얼굴 물려   바늘 꿰맸다 ,Social
55, 단독  김상조 이호승  부동산원  통계 유출 그만  요청 묵살      관련 진술 확보,Social
56,고속도로      역주행  공포의 택시  경찰에 붙잡힌 기사  황당  해명,Social
57, 코로나   예방접종  효과 있었다    질병청   중증화 예방효과  확인,Social
58,고양시 원혜진 주무관 열정 뿜뿜  고양    새 얼굴,Social
59,롤스로이스 가해 남성에게 마약 불법 처방한 의사 구속기소,Social
60, 해직교사 부당채용  조희연 대법 간다  징역형 집유  불복 상고,Social
61,  현대중공업  방파제 복구비용 보전소송 승소,Social
62,경찰   음대 교수 입시 비리 의혹  경희대 압수수색,Social
63,음대 교수가 입시생  불법 과외   경희대 압수수색,Social
64,세종시 대중교통 이용객  쑥쑥     월 시행  이응패스   통합환승  주목,Social
65, 버닝썬  승리   뜬금 허세     중국풍 일본풍 그림 올린   재외공관   프레스룸               ,Social
66,정쟁 떠난 대구 수성갑 여 야 예비후보들의 출근길 인사,Social
67, 액운 털어내려고  울산 대왕암공원  바다남  낙서   대 검거,Social
68,   같이 타고 가자     자리 있습니까  갈등 이틀만에  봉합 열차    프레스룸     이슈    ,Social
69, 포병여단 흑곰대대 군인아저씨는 우리 선생님  교육봉사활동 화제,Social
70, 주차된 차에 사람 쓰러져 있다  인천서 남녀  명 숨진 채 발견,Social
71, 위기의 부경동물원  잔여동물 구제책 마련한다,Social
72, 선처해달라   신생아  숨지게 한 친엄마들 첫 재판서 눈물의 호소,Social
73,류석춘  위안부 매춘  발언 무죄   법원 판결의 긴 서술어,Social
74,   도 인사   어깨 툭      서천 현장 동행    국민 배경  정치쇼    프레스룸     이슈    ,Social
75,검찰   롤스로이스  마약 처방  의사 구속기소 환자 성폭행 혐의도,Social
76,롤스로이스 에 마약 처방 의사  환자 성폭행 혐의 구속기소,Social
77,    국민 눈물 거부한 비정한 대통령으로 기억될 것인가  이태원 참사 ,Social
78, 경찰 앞에서 무아지경  집에서 나체로 피흘린    옆집서 신고했더니 체포 왜 ,Social
79,제주 해안 대설특보 모두 해제 하늘길 뱃길 정상화 수순 종합 ,Social
80, 기름   억  훔친 도둑들 잠복 근무에 딱 걸렸다,Social
81,제주 해안 대설특보 모두 해제 하늘길 뱃길 정상화 수순 종합 ,Social
82,    갈등 봉합 수순      대학생   군장병 행보   항공기    여 편 결항  프레스룸     앵커브리핑 ,Social
83, 이시각헤드라인   월   일 뉴스센터  ,Social
84,      폄훼  허식  인천시의장직 박탈  혼미할 정도로 힘들다 ,Social
85,출생아  개월째  만 명대 작년     월   만  천 명 역대 최소,Social
86, 서천특화시장 화재  원인은 합동 감식 돌입,Social
87,이런 차만 털렸다     만원어치 금품 훔친   대 구속,Social
88, 따뜻한 한 끼 나눠요  추위 잊은 따뜻한 온정,Social
89, 지난해  월부터 미분양관리지역인데   포항서     가구 분양,Social
90,민폐 주차 차량 지붕에 주차금지 입간판 올렸다가 벌금형 항소심  원심 깨고 무죄판결,Social
91,  인미만 중대재해법     정부  준비할 기회달라  마지막 호소,Social
92,학원가  마약음료 사건  주범  국내 송환 한 달 만에 구속기소,Social
93,지구대 찾아와 흉기 휘두른   대  무술   단 경찰이 제압,Social
94,대구서 경주까지 경부고속도로     역주행한 택시,Social
95,정무 비서 지낸 전희경  의정부  갑  출사표,Social
96,인천 자월도 해안가 차량서 남녀  명 숨진 채 발견,Social
97,청년근로자 월   만원 저축하면  년 후   천만원    받는다,Social
98,서울 강남구서 첫째 낳으면 누구나 첫 달  최대    만원 ,Social
99,  대 이웃 성폭행한 살인 전과자   심서 형량 늘어  징역   년 ,Social
100,서울 강남구에서 첫째 낳으면 첫 달    만원 보따리 푸는 자치구,Social
101,    일째 장례 못치른  분신 택시노동자  대표 엄벌하라 ,Social
102, 인구 블랙홀 경기도    년 새    만명 증가  천   만명,Social
103,지구대서 흉기 난동부린   대  무술   단  경찰이 제압,Social
104, 장애아 낳은 게 잘못  망언 오태원 부산 북구청장  공개 사과,Social
105,도로망 개선 나서는 고양시  출퇴근 시간 획기적으로 줄입니다 ,Social
106,중처법    인 미만  확대      적용유예 논의 중단하라 ,Social
107, 친절한 뉴스    산업스파이 꼼짝마   처벌 강화한다,Social
108,  천억대 유사수신  아도인터내셔널 대표 모집책 기소,Social
109,경찰  교수 불법과외 의혹 경희대 음대 압수수색 종합 ,Social
110, 으아아악  피 흘리며 알몸으로 발작하는 남성  경찰이 잡고 보니,Social
111,노동부 장관  빵집 사장도 대상  중대재해법 유예 호소 민주노총  더 이상 안돼 ,Social
112, 이경규 장도연 출연료 미지급  기획사 대표  이번엔 횡령 혐의로 유죄  사사건건 ,Social
113,수도권 대형병원   곳이 같은 날 간호사 뽑는 이유는,Social
114,음료 무료 서비스 줬더니  애 당뇨 걸려  제로 없어   고함 친 진상 손님,Social
115,경찰   지하철 탑승 시위  전장연 활동가에 구속영장 신청,Social
116,  억원대 선박 연료 빼돌려 불법 유통한   명 검거,Social
117,사망 사고 낸 롤스로이스 에 마약 처방한 의사 구속기소,Social
118,  대 택시기사 고속도로      역주행  트레픽 브레이크 로 사고 막았다,Social
119,부산 청년들 울린    억대 전세사기   대   징역   년,Social
120,검찰  롤스로이스 운전자 마약 처방 의사 구속기소,Social
121,백미러 안 접힌 차량만 노려     만원 훔친   대 구속,Social
122,사이다 서비스 줬더니  애 당뇨 걸리니 제로로  할 거면 제대로 해 ,Social
123, 대왕암 앞에 거대 불상 건립 말라  기독교단체 반발,Social
124,부산서    억원 전세 사기   대  심서 징역   년 선고,Social
125,교육부   음대 교수 입시비리 의혹  경희대 현장조사,Social
126, 롤스로이스 사망 사건  운전자 징역   년 선고,Social
127,출산율 뚝뚝 떨어져도 강남구  나홀로 증가 ,Social
128, 위안부 발언  류석춘 무죄 정대협 명예훼손은 벌금형,Social
129,서울 은평구 아파트 화재 주민   여 명 대피,Social
130, 압구정 롤스로이스  가해자 징역   년 선고,Social
131, 월 총선 여야 공천심사 앞두고 경기지역 과열 혼탁 양상,Social
132,수리 중 움직인 엘리베이터   대 작업자 추락사,Social
133, 주유 덜 해서 빼돌려  해상유    만 리터 불법 유통한 일당 체포,Social
134,주식 사놓고 셀프 추천한 애널리스트 징역  년 개월에 항소,Social
135, 롤스로이스 뺑소니  가해자 징역   년  중형 선고 필요 ,Social
136,음주운전   대 러시아인  가로등 들이받아 차량 전소,Social
137,   억 전세사기   대 징역 중형 청년들 마음 어루만진 판결문 눈길,Social
138,회사 망하는 줄 모르고   퍼주다  전직원 해고통보 한 업체,Social
139,해상유    만  몰래 빼돌려   고유가 속   억 챙겨,Social
140,사흘째 계속되는 한파 수도계량기    건 동파,Social
141,흉기 들고 지구대서 난동 부린   대   유단자 경찰 이 제압,Social
142, 위안부  매춘의 일종  류석춘  심 무죄 선고,Social
143, 강남 마약 음료    대 주범 구속 기소 미성년자 마약 투약 혐의,Social
144, 단독  간첩 잡는다며    년된 보안망 쓰는 경찰 안보수사단,Social
145, 직원 채용 시 학력차별 말라  인권위 권고  연세대만 불수용,Social
146,충남 서천 수산물특화시장 화재현장   차 합동감식 ,Social
147,수도권 상급종합병원   월부터 신규간호사 동시에 최종면접,Social
148,직장내괴롭힘 신고인이  가해자  근무장소 바꿔달라는데 ,Social
149,   병원 스토리 수도권 상급종합병원 신규 간호사 최종 면접 같은 기간 시행,Social
150,성희롱 신고라고 성희롱만 따져보고 사건 종결했다가는 ,Social
151,임금체계 개편  단 하나의 정답은 없다 ,Social
152,외항선  해상유  몰래 슬쩍   억 원어치 빼돌린 일당 검거,Social
153,평택항 해상유   억원치 빼돌린 일당   명 검거,Social
154, 육아휴직 복귀했더니 승진 누락됐네요 ,Social
155,분신 택시기사 대책위  반성없는 회사 대표 엄벌을 ,Social
156,인권위  직원 채용 시 학력차별 개선 권고 연세대 거부,Social
157,대설 한파에 결항 동파 속출 제주공항 재개,Social
158,분신 택시기사 대책위  반성없는 회사 대표 엄벌을 ,Social
159,인권위  직원 채용 시 학력차별 개선 권고 연세대 거부,Social
160, 전북특별자치도 기획 상 대한민국  극 특 퍼즐 완성,Social
161,정부  약가 보장성 확대  필수약제 안정적으로 공급 ,Social
162,벙커 유 수십억원 어치 빼돌린 일당 검거 선장 등 구속,Social
163,인권위  교직원 채용에 학력 출신학교 제한은 차별  연세대 불수용,Social
164,검찰  중국서 송환된  강남 마약음료  제조책 구속기소,Social
165,제주공항 운항 재개   해안지역 눈발 약해져,Social
166,해상유   억어치 빼돌려 불법 유통한 유조선 선장 일당 송치,Social
167,간호사 수급난 없게 수도권 상급종합병원 채용면접 동시 실시,Social
168,인권위  연세대  직원 뽑을 때 학력제한 개선 권고 안받아들여 ,Social
169,외항선 기름 주유하면서   억 원어치 빼돌린 일당 검찰 송치,Social
170,인천 평택항서 벙커 유 빼돌린 선장 탱크로리 기사 일당,Social
171,한쪽 눈 치료에만  억 들던  이 병  건보 적용     만원만 낸다,Social
172, 빼돌리거나 눈속임    억 상당 해상유 가로챈 일당   명 일망타진,Social
173, 변이 바이러스에도 효과  코로나   백신 맞으니 중증화율  뚝 ,Social
174,검찰   강남 학원가 마약 음료  주범 구속 기소,Social
175,류석춘  위안부 매춘  발언 무죄 정대협 명예훼손은 벌금,Social
176,사흘간 서해안에 눈    너무 추운데 폭설까지 ,Social
177, 육아휴직 복귀했더니 승진 누락됐네요 ,Social
178, 주민도 모르게 추진    함양 지방소멸기금으로 골프장 웬 말이냐 ,Social
179,작년 강남구 출생아         첫아이 낳으면 최대    만 원 ,Social
180,뉴진스 민지로  칼국수  삼행시      기사 삭제 사과,Social
181, 자막뉴스   저게 뭐야    고속도로 달리던 앞 차에서 날아온 흉기에  쾅 ,Social
182, 내가 기소한 사건  구형 줄여줄게  돈 받은 전직 검사 징역  년,Social
183,마당에 쌓인 눈으로 커피 음료를  위더스푼 레시피 화제,Social
184,광주 서구 전 현직 의원  김광진은 광주의 자랑이고 서구의 자산 ,Social
185, 류희림 청부 민원  공익신고자  경찰 수사로 신변 위협,Social
186,검찰      억 편취  혐의 아도인터내셔널 대표 추가기소,Social
187,얼굴 덮는 거대종양  의술  아프리카 여성에 미소 선물,Social
188,조용익 부천시장  중동 기 신도시  재건축 선도지구  선정 추진 ,Social
189,이재명  윤 대통령 한동훈  정치쇼   김 여사 의혹은  수사받아야 ,Social
190,서울형 키즈카페   년 반 만에   만명 이용    개로 늘린다,Social
191, 코로나 때 자살 충동  느낀   대    의  배 왜 그런가 봤더니,Social
192,가짜초청장 수백명 불법입국   대 추가 기소 실형 추가,Social
193,  시세   나  젊은 꼰대냐      이어 알파에 밀려나는  세대,Social
194,검찰   롤스로이스 사건  마약류 처방 의사 구속기소,Social
195,법원 연락 금지 명령에도  전처에    차례 문자 보낸   대 징역  년,Social
196,  대 사망케 한 롤스로이스 운전자에 마약 처방    의사 구속기소,Social
197,경기 남 북 의료인프라 격차 심화  상급종합병원 북부엔   곳 ,Social
198, 포스트 태릉빙상장  어디로  경기    강원 격돌,Social
199, 수사 무마 해줄게  청탁 명목으로 수억 뜯은 검사 출신 변호사,Social
200,녹말 이쑤시개  식품 아닙니다 먹으면 안 되는 이유,Social
201, 고의 아니다  영아 살해 친모들 첫 재판서  선처호소 ,Social
202,검찰   강남 마약음료 사건 제조책    대 구속기소,Social
203,작년 강남구 출생아         첫아이 낳으면 최대    만원 ,Social
204,인천 자월도 차량서 남녀  명 숨진 채 발견 경찰 수사,Social
205,서울시의회 민주당  김현기 의장  사견 발표를 기자간담회로 ,Social
206, 압수한 돈 돌려줘  보이스피싱 환전책  국가 상대로 소송 냈다 패소,Social
207, 집안 남자들에 좋은 기운 주려고  울산 대왕암에  바다남  낙서한   대 여성 붙잡혀,Social
208,중대재해법 확대 준비 못해놓고  공포 마케팅 하는 노동부,Social
209,바위틈 넣어둔 속옷에 덜미  대왕암공원 바위  바다남  낙서 범인은   대 여성,Social
210, 영상  흉기 들고 지구대 찾은   대   무술   단  경찰관이 제압,Social
211,흉기 들고 지구대서 난동 부린   대 유단자 경찰이 제압,Social
212,강남구  첫 아이 출산 시 첫 달 최대    만원 지원,Social
213,  세에 초등학력 인증  거창 이근순 할머니  못 배운 한 풀어 ,Social
214,올림픽대로서     로 저속주행  길막  유튜버 논란,Social
215,경찰   지하철 탑승 시위  전장연 활동가 구속영장 신청,Social
216, 위안부는 매춘  류석춘  심  무죄      의견 소명일 뿐  종합 ,Social
217,서천 특화시장 합동감식 착수 발화지점 원인 조사,Social
218,밀양서 사고 난 차량 받은   대 오토바이 운전자 숨져,Social
219, 위안부는 매춘의 일종  발언한 류석춘 무죄  정대협 명예훼손은 유죄로 벌금형,Social
220, 단독  경찰   음대 교수 입시 비리 의혹  경희대 압수수색,Social
221,한파에 수도관 계량기    건 동파 항공  편 결항 뱃길 통제 늘어,Social
222,강풍 폭설에 멈췄던 제주공항 정상화 임시편도 투입,Social
223, 위안부는 매춘  발언 류석춘 무죄  부적절하지만 학문의 자유 ,Social
224, 무료 콜라 중고거래하려고 리뷰 열심히 써요  각양각색 중고거래하는 고물가시대 청년들,Social
225, 위안부 자발적 매춘  류석춘 교수 무죄    추상적 표현 ,Social
226,하급자 사비로 상사 식사 챙기는  모시는 날   부산경찰  감찰 조사,Social
227,대설로 중단된 제주공항 항공기 운항 정상화,Social
228,금산 불산 누출 공장  피해 주민   명에    만 원씩 배상,Social
229, 위안부 매춘  무죄받은 류석춘  유죄부분도 항소할 것 ,Social
230, 젠더 데스크 기자   성평등 보도 확산에 기여 언론사 안팎 편견은 여전,Social
231,정의연  반역사적 판결  류석춘  위안부 매춘  명예훼손 무죄에 반발,Social
232,남편을 간병하며 폭언 듣는 아내,Social
233, 피해자 보며 웃어   질타한 판사 롤스로이스   징역   년  선고,Social
234, 자막뉴스   위안부는 자발적 매춘  류석춘  년 만에  무죄  이유는 ,Social
235,회삿돈  억 원 빼돌려 도박에 탕진한 직원 실형,Social
236,살인죄 출소 직후   대 노인 때리고 성폭행  심서 형량 늘어,Social
237, 위안부 매춘의 일종  발언 류석춘 무죄 정대협 명예훼손은 일부 유죄  벌금    만원 ,Social
238, 압구정 롤스로이스   심 징역   년 유족측  뉘우침 없어  종합 ,Social
239,국민연금 월 평균 수령액 전국  위는 울산 동구,Social
240,대통령 집무실 앞 이태원 유족들  법안 거부가 국정 기조입니까 ,Social
241,  년 전 이혼한 전처에    차례 문자 보낸   대 징역  년,Social
242, 지하철 운행 방해  전장연 활동가 구속영장 경찰  역무원들에게 상해 입혀 ,Social
243,부산 북항재개발지 관통  이순신대로    일 개통,Social
244,울산시  대왕암공원에 거대 불상 추진 기독교계  철회하라 ,Social
245, 제보는   요청해도 촬영 안 하면  무용지물     현실 맞게 바뀌어야 ,Social
246,      폄훼  논란 인천시의장 불신임안 가결 의장직 잃었다,Social
247,대법  환경오염 피해  개연성만 입증하면 배상 책임 인정  첫 판결,Social
248, 구독자 모집 대가 금품 거래  전직 기자  경찰  심도 벌금형,Social
249,     직장인   명 중  명  대중교통 스트레스 ,Social
250,밀양서 음주운전 승용차 추돌한   대 오토바이 운전자 사망,Social
251,반복적 음주운전하다 적발되자 친언니 주민번호 댄   대 징역형,Social
252, 압구정 롤스로이스 사고  가해자  심 징역   년    의사 만류에도 운전 ,Social
253,행인 치어 숨지게 한  압구정 롤스로이스    대   심 징역   년,Social
254,김광진 서구을 예비후보 지지선언 이어져,Social
255,경찰 국과수 소방  서천특화시장 화재 원인 규명  감식 시작,Social
256, 롤스로이스 가해 남성   심 징역   년     잘못 반성 안 해 ,Social
257,     올림픽 프렌즈  배우 이동욱  동계청소년올림픽  응원  동참,Social
258,영화관 화장실에 다른 층 손님 우르르  휴지값 돌려줘  소송,Social
259,울산 기암괴석에 기괴한 낙서 범인이 밝힌 황당한 이유,Social
260, 위안부 매춘 발언  류석춘 무죄  교수의 자유제한 최소화해야  종합 ,Social
261, 상사 모시는 날   익명 신고에 부산경찰청  감찰 조사 중 ,Social
262, 나 잡아봐라  방안에서 나체 상태로 뛰어다닌 남성  체포된 이유,Social
263,노량진 일대 대규모 아파트 단지로 바뀐다 재개발 계획 잇따라 통과,Social
264, 시의원들에게 여비 준 혐의  강수현 양주시장  불구속 송치,Social
265, 강남 마약 롤스로이스 뺑소니  가해자 징역   년 선고,Social
266,  위안부 는 자발적 매춘  류석춘 무죄 정대협 명예훼손은 벌금형,Social
267, 고생  고단함 에서  강인함 이미지로   다큐 사진이 제주해녀 인식 바꿨다,Social
268,인천 자월도 해변 차량서 남녀  명 숨진 채 발견,Social
269,경찰 앞에서 피 흘리며 뛰어다닌 알몸  집에서  이것  발견됐다,Social
270,      폄훼  논란 인천시의장 해임  불신임안 의결,Social
271, 회삿돈  억  빼돌린   대 직원  쇼핑 도박 에 탕진했다,Social
272,류석춘  위안부 발언  무죄 정의연 명예훼손은 벌금형 종합 ,Social
273,나주서 오피스텔 보증금   억 원 가로챈   대 구속,Social
274,음주운전 전과 공무원 또 만취운전  이번에는 집행유예,Social
275,간식 주려다 얼굴 물렸다    부산 도심에 나타난 들개에 비상,Social
276,눈 잦아든 제주   오늘 하루  만    명 빠져나간다,Social
277, 형량 줄여줄게  속여  억     만 원 빼돌린 검찰 출신 변호사  심 징역  년,Social
278, 입사 목적이 횡령    개월간  억 빼돌려 도박에 탕진한   대,Social
279, 위안부는 자발적 매춘  발언 류석춘 전 교수 무죄,Social
280,경부고속도     역주행 택시  트래픽 브레이크로 막은 경찰,Social
281,약물 뺑소니  압구정 롤스로이스남   심 징역   년 선고,Social
282, 과거를 묻지 마라  섬뜩한 가해자의 용어  전쟁과 문학 ,Social
283,엉덩이 주무른 트레이너 성추행 무혐의에   피해 여성  분통 ,Social
284,서울 노량진 구역  최고   층으로    가구 공급   건축심의 통과,Social
285, 전청조  스페인서  머스크와 펜싱  자작극 남현희  본인 안 데려가 기분 나빠해 ,Social
286, 들개에 물렸다  부산서 아찔 사고 사나운 개 만났을 때 대처법,Social
287, 이경규 등에 출연료 미지급  기획사 대표  횡령 혐의로 집행유예,Social
288,밀양 국도   호선서 오토바이 승용차 충돌  명 숨져,Social
289, 지하철 탑승 시위  전장연 활동가 구속 기로,Social
290,광주 전남 사흘간       폭설 오후 특보 해제될듯,Social
291,학생들에  합성 능욕  당한 초등교사  되레  아동학대 로 신고 당했다,Social
292,복지장관  의대 정원 늘린 호주 프랑스 고위관계자들 만나 정책 논의,Social
